{
  "packages": [
    {
      "name": "@pascal-app/core",
      "version": "0.9.2",
      "package_json_blob_sha1": "ada4f58be5494e031675a40663471a24afdfc3f0"
    },
    {
      "name": "@pascal-app/viewer",
      "version": "0.9.2",
      "package_json_blob_sha1": "86565ea117ff1fe666f1b7e93d3c40d105f502df"
    },
    {
      "name": "@pascal-app/editor",
      "version": "0.9.2",
      "package_json_blob_sha1": "73d5899ffe7d80342e06f37b9cda877ffb51a768"
    },
    {
      "name": "@pascal-app/nodes",
      "version": "0.1.1",
      "package_json_blob_sha1": "a9eb033b1ad277cd6d0d8712bb696f01a132d487"
    }
  ],
  "local_assets": [
    {
      "path": "aura_showcase/pascal-construction-foundry.css",
      "sha256": "74133eb9aa8f421eaa85c96558163c5e08026a990e32b7cd05df279812e5aa36"
    },
    {
      "path": "aura_showcase/pascal-construction-foundry.js",
      "sha256": "6d573564f423d4c194c7b0a9991cfbab64ef579795521c4f6d17db536f17c0cd"
    },
    {
      "path": "aura_showcase/pascal-workbench/fixture.json",
      "sha256": "eafed1a7c858041e14195dc7e734fb97da0e03ce9facf09c156b09f655587e66"
    },
    {
      "path": "aura_showcase/pascal-workbench/index.html",
      "sha256": "61040c34eb500f9dc6611ade3940673698e66cb184a5f5a518b480661f178ab8"
    },
    {
      "path": "aura_showcase/pascal-workbench/pascal-workbench.css",
      "sha256": "e3b7cc7f2b2c091c3adfe15c89602810e2941794648b9fc47bc7ce37fba6002c"
    },
    {
      "path": "aura_showcase/pascal-workbench/pascal-workbench.js",
      "sha256": "9884fef6303c3cc93ca470004188c7aac3d0a492e7d1ae9bf2bd655547990dd7"
    },
    {
      "path": "third_party/pascal/LICENSE",
      "sha256": "9c9dde8dcf117ba360494755ecc610b446f09786b67356377f8d683ab8ffb38f"
    },
    {
      "path": "third_party/pascal/package-metadata/core.package.json",
      "sha256": "bde347a5bb2bffa6f47204d79899f39dcd7a42d7e9fb8ecc1d32763bcf6c0994"
    },
    {
      "path": "third_party/pascal/package-metadata/editor.package.json",
      "sha256": "2d0197d9b6b5ec152ff41cf1a79b39aa3d9582b9e2cde41490339f392cfc6e49"
    },
    {
      "path": "third_party/pascal/package-metadata/nodes.package.json",
      "sha256": "eb5f6eeaac4bf90cbb13c9f0bc01f7a43d604c801bfbecaf5880258f4051a54a"
    },
    {
      "path": "third_party/pascal/package-metadata/viewer.package.json",
      "sha256": "7922c8035c77dbe99644beaed0af0ad29c43d98c11d46cae484c8ab7e6737857"
    }
  ],
  "repository": "pascalorg/editor",
  "commit": "42ac4be1ce5f3fee74806aa093267b6fee77d47d",
  "license": "MIT",
  "external_asset_fetch": false,
  "remote_plugin_fetch": false,
  "persistent_canonical_storage": false,
  "version": "AURA_PASCAL_SOURCE_LOCK_V1",
  "lock_digest": "7c0830edc42139cf43b61c7365996b33abb86ccb54b3389761418b73b9fced08"
}
